{
  "$schema": "http://json-schema.org/draft-07/schema#",
  "$id": "https://asdd-harness-kit.io/schemas/feature.schema.json",
  "title": "ASDD Harness Feature Document",
  "description": "Feature tracker for a single slice. Validated by check-invariants.mjs.",
  "type": "object",
  "required": ["schema_version", "slice_id", "source_tasks", "features"],
  "properties": {
    "schema_version": {
      "type": "string",
      "const": "1.0",
      "description": "Schema version of the feature document."
    },
    "slice_id": {
      "type": "string",
      "minLength": 1,
      "description": "Identifier of the slice these features belong to."
    },
    "source_tasks": {
      "type": "string",
      "minLength": 1,
      "description": "Repository-relative path to the tasks.md file that produced these features."
    },
    "features": {
      "type": "array",
      "description": "List of features. May be empty for slices in discovery/spec phase.",
      "items": {
        "$ref": "#/definitions/feature"
      }
    }
  },
  "definitions": {
    "feature": {
      "type": "object",
      "required": ["id", "title", "user_visible_behavior", "status", "priority", "verification"],
      "properties": {
        "id": {
          "type": "string",
          "minLength": 1,
          "description": "Unique feature identifier within the slice."
        },
        "title": {
          "type": "string",
          "minLength": 1,
          "description": "Human-readable feature title."
        },
        "user_visible_behavior": {
          "type": "string",
          "minLength": 1,
          "description": "Description of the observable behavior from a user perspective."
        },
        "status": {
          "type": "string",
          "enum": ["not_started", "pending", "in_progress", "blocked", "passing", "abandoned"],
          "description": "Current lifecycle status of the feature (session-loop.md uses not_started | in_progress | blocked | passing; pending and abandoned are accepted)."
        },
        "priority": {
          "type": "integer",
          "minimum": 1,
          "description": "Execution priority (1 = highest)."
        },
        "area": {
          "type": "string",
          "description": "Slice or module the feature belongs to (session-loop.md)."
        },
        "verification": {
          "type": "array",
          "minItems": 1,
          "description": "List of verification steps or criteria.",
          "items": {
            "type": "string",
            "minLength": 1
          }
        },
        "evidence": {
          "type": "string",
          "description": "Filled only when status is 'passing'. Describes what ran and the result."
        },
        "evidence_commit": {
          "type": "string",
          "pattern": "^[0-9a-fA-F]{7,40}$",
          "description": "SHA of the commit containing the verified code. Required when status is 'passing'. Drift check DRIFT-02 compares scope_paths against it."
        },
        "depends_on": {
          "type": "array",
          "description": "IDs of features that must be 'passing' before this one can start.",
          "items": {
            "type": "string",
            "minLength": 1
          }
        },
        "owner": {
          "type": "string",
          "description": "Agent or worker identity owning this feature. Required when multiple features are in_progress concurrently."
        },
        "scope_paths": {
          "type": "array",
          "description": "Non-empty repo-relative files/directories this feature owns. Required on every feature (DRIFT-06); must not overlap between concurrent in_progress features.",
          "items": {
            "type": "string",
            "minLength": 1
          }
        },
        "req_ids": {
          "type": "array",
          "description": "EARS requirement IDs traced to this feature.",
          "items": {
            "type": "string",
            "minLength": 1
          }
        },
        "notes": {
          "type": "string",
          "description": "Optional free text: REQ links, blockers (session-loop.md)."
        },
        "story_ids": {
          "type": "array",
          "description": "Traceability to upstream tracker stories (external-trackers skill).",
          "items": {
            "type": "string",
            "minLength": 1
          }
        }
      }
    }
  }
}
